export const INITIAL_RFQ_LIST = [
  {
    no: 1,
    desc: 'PANEL ASSY, FLOOR, LH',
    referenceNo: '04',
    rfqNo: 'SPQM50-04012024-0001-NORMAL',
    pno: '5251409289',
    aes: 'A',
    quantity: 1,
    status: 'Quoted',
    date: '08/01/2025 2:30PM',
    timestamp: new Date('2025-01-08T14:30:00').getTime(),
    lastEditedBy: {
      name: 'Admin User',
      initials: 'AD',
      timestamp: '08/01/2025 2:30PM'
  },
    statusTimeline: [
      {
        status: 'Created',
        timestamp: '08/01/2025 2:30PM'
      },
      {
        status: 'Quoted',
        timestamp: '08/01/2025 2:30PM'
      }
    ],
    collaborators: [
      {
        id: '2',
        name: 'erma',
        email: 'erma@baktiudara.com',
        initials: 'ER',
        addedAt: '08/01/2025 1:00PM'
      },
      {
        id: '3',
        name: 'adda',
        email: 'adda@baktiudara.com',
        initials: 'AD',
        addedAt: '08/01/2025 12:30PM'
      }
    ],
    documents: [
      {
        id: 1,
        name: 'Technical Specifications.pdf',
        type: 'PDF',
        size: '2.4 MB',
        uploadDate: '08/01/2025 1:45PM',
        url: '#'
      },
      {
        id: 2,
        name: 'Engineering Drawings.dwg',
        type: 'DWG',
        size: '5.1 MB',
        uploadDate: '07/01/2025 4:20PM',
        url: '#'
      },
      {
        id: 3,
        name: 'Material Certificate.xlsx',
        type: 'Excel',
        size: '1.2 MB',
        uploadDate: '05/01/2025 9:30AM',
        url: '#'
      },
      {
        id: 4,
        name: 'Quality Inspection Report.pdf',
        type: 'PDF',
        size: '3.8 MB',
        uploadDate: '01/01/2025 11:15AM',
        url: '#'
      }
    ]
  },
  {
    no: 2,
    desc: 'RELAY, SOCKET',
    referenceNo: '04',
    rfqNo: 'SPQM50-04012024-0002-NORMAL',
    pno: '9742200100',
    aes: 'E',
    quantity: 3,
    status: 'Quoted',
    date: '08/01/2025 10:15AM',
    timestamp: new Date('2025-01-08T10:15:00').getTime(),
    lastEditedBy: {
      name: 'John Smith',
      initials: 'JS',
      timestamp: '08/01/2025 10:15AM'
    },
    statusTimeline: [
      {
        status: 'Created',
        timestamp: '08/01/2025 10:15AM'
      },
      {
        status: 'Quoted',
        timestamp: '08/01/2025 10:30AM'
      },
      {
        status: 'Quoted',
        timestamp: '08/01/2025 11:00AM'
      }
    ],
    collaborators: [],
    documents: [
      {
        id: 1,
        name: 'Relay Specifications.pdf',
        type: 'PDF',
        size: '1.8 MB',
        uploadDate: '08/01/2025 10:00AM',
        url: '#'
      },
      {
        id: 2,
        name: 'Socket Assembly Guide.pdf',
        type: 'PDF',
        size: '2.2 MB',
        uploadDate: '08/01/2025 9:45AM',
        url: '#'
      }
    ]
  },
  {
    no: 3,
    desc: 'ROD ASSY, PUSH/PULL, FRONT',
    referenceNo: '04',
    rfqNo: 'SPQM50-04012024-0004-NORMAL',
    pno: '576.10.09.021',
    aes: 'E',
    quantity: 1,
    status: 'Quoted',
    date: '07/01/2025 3:45PM',
    timestamp: new Date('2025-01-07T15:45:00').getTime(),
    lastEditedBy: {
      name: 'Sarah Wilson',
      initials: 'SW',
      timestamp: '07/01/2025 3:45PM'
    },
    statusTimeline: [
      {
        status: 'Created',
        timestamp: '07/01/2025 3:45PM'
      },
      {
        status: 'Quoted',
        timestamp: '07/01/2025 4:00PM'
      },
      {
        status: 'Quoted',
        timestamp: '07/01/2025 4:30PM'
      },
      {
        status: 'Quoted',
        timestamp: '08/01/2025 9:15AM'
      }
    ],
    collaborators: [],
    documents: [
      {
        id: 1,
        name: 'Rod Assembly Drawing.dwg',
        type: 'DWG',
        size: '3.5 MB',
        uploadDate: '07/01/2025 3:30PM',
        url: '#'
      }
    ]
  },
  {
    no: 4,
    desc: 'MUDGUARD ASSY',
    referenceNo: '04',
    rfqNo: 'PA/AOG/M50/040123/EMAIL',
    pno: '5322009158',
    aes: 'E',
    quantity: 1,
    status: 'Quoted',
    date: '06/01/2025 11:20AM',
    timestamp: new Date('2025-01-06T11:20:00').getTime(),
    lastEditedBy: {
      name: 'Mike Johnson',
      initials: 'MJ',
      timestamp: '06/01/2025 11:20AM'
    },
    statusTimeline: [
      {
        status: 'Created',
        timestamp: '06/01/2025 11:20AM'
      },
      {
        status: 'Quoted',
        timestamp: '06/01/2025 11:35AM'
      }
    ],
    collaborators: [],
    documents: []
  },
  {
    no: 5,
    desc: 'NUT',
    referenceNo: '04',
    rfqNo: 'PA/RO1/M50/260123/EMAIL',
    pno: '114.40.07.097',
    aes: 'E',
    quantity: 1,
    status: 'Quoted',
    date: '05/01/2025 4:10PM',
    timestamp: new Date('2025-01-05T16:10:00').getTime(),
    lastEditedBy: {
      name: 'Lisa Brown',
      initials: 'LB',
      timestamp: '05/01/2025 4:10PM'
    },
    statusTimeline: [
      {
        status: 'Created',
        timestamp: '05/01/2025 4:10PM'
      },
      {
        status: 'Quoted',
        timestamp: '05/01/2025 4:25PM'
      },
      {
        status: 'Quoted',
        timestamp: '06/01/2025 9:00AM'
      }
    ],
    collaborators: [],
    documents: []
  },
  {
    no: 6,
    desc: 'HOSE ASSY',
    referenceNo: '04',
    rfqNo: 'PA/NOR/M50/110123/EMAIL',
    pno: '959.90.01.255',
    aes: 'E',
    quantity: 1,
    status: 'Quoted',
    date: '04/01/2025 9:30AM',
    timestamp: new Date('2025-01-04T09:30:00').getTime(),
    lastEditedBy: {
      name: 'David Lee',
      initials: 'DL',
      timestamp: '04/01/2025 9:30AM'
    },
    statusTimeline: [
      {
        status: 'Created',
        timestamp: '04/01/2025 9:30AM'
      },
      {
        status: 'Quoted',
        timestamp: '04/01/2025 10:00AM'
      },
      {
        status: 'Quoted',
        timestamp: '05/01/2025 2:00PM'
      },
      {
        status: 'Quoted',
        timestamp: '06/01/2025 3:30PM'
      }
    ],
    collaborators: [],
    documents: []
  },
  {
    no: 7,
    desc: 'ROD OPERATING RH',
    referenceNo: '04',
    rfqNo: 'PA/RO1/M50/260123/EMAIL',
    pno: '5323009336',
    aes: 'A',
    quantity: 1,
    status: 'Quoted',
    date: '03/01/2025 1:15PM',
    timestamp: new Date('2025-01-03T13:15:00').getTime(),
    lastEditedBy: {
      name: 'Emma Davis',
      initials: 'ED',
      timestamp: '03/01/2025 1:15PM'
    },
    statusTimeline: [
      {
        status: 'Created',
        timestamp: '03/01/2025 1:15PM'
      },
      {
        status: 'Quoted',
        timestamp: '03/01/2025 1:30PM'
      }
    ],
    collaborators: [],
    documents: []
  },
  {
    no: 8,
    desc: 'HOSE ASSY',
    referenceNo: '04',
    rfqNo: 'SPQM50-15012025-0001-RO1',
    pno: '9599001248',
    aes: 'A',
    quantity: 1,
    status: 'Quoted',
    date: '01/01/2025 8:45AM',
    timestamp: new Date('2025-01-01T08:45:00').getTime(),
    lastEditedBy: {
      name: 'Tom Wilson',
      initials: 'TW',
      timestamp: '01/01/2025 8:45AM'
    },
    statusTimeline: [
      {
        status: 'Created',
        timestamp: '01/01/2025 8:45AM'
      },
      {
        status: 'Quoted',
        timestamp: '01/01/2025 9:00AM'
      },
      {
        status: 'Quoted',
        timestamp: '02/01/2025 10:30AM'
      },
      {
        status: 'Quoted',
        timestamp: '03/01/2025 2:15PM'
      }
    ],
    collaborators: [],
    documents: []
  },
  {
    no: 9,
    desc: 'ROD OPERATING LH',
    referenceNo: '04',
    rfqNo: 'SPQM50-15012025-0002-RO1',
    pno: '5323009337',
    aes: 'A',
    quantity: 1,
    status: 'Quoted',
    date: '31/12/2024 2:50PM',
    timestamp: new Date('2024-12-31T14:50:00').getTime(),
    lastEditedBy: {
      name: 'Anna Garcia',
      initials: 'AG',
      timestamp: '31/12/2024 2:50PM'
    },
    statusTimeline: [
      {
        status: 'Created',
        timestamp: '31/12/2024 2:50PM'
      },
      {
        status: 'Quoted',
        timestamp: '31/12/2024 3:10PM'
      },
      {
        status: 'Quoted',
        timestamp: '02/01/2025 11:00AM'
      }
    ],
    collaborators: [],
    documents: []
  },
  {
    no: 10,
    desc: 'PLACARD, TYRE PRESSURE',
    referenceNo: '04',
    rfqNo: 'SPQM50-15012025-0003-RO1',
    pno: '511.20.09.121',
    aes: 'E',
    quantity: 2,
    status: 'Quoted',
    date: '25/12/2024 10:30AM',
    timestamp: new Date('2024-12-25T10:30:00').getTime(),
    lastEditedBy: {
      name: 'Chris Taylor',
      initials: 'CT',
      timestamp: '25/12/2024 10:30AM'
    },
    statusTimeline: [
      {
        status: 'Created',
        timestamp: '25/12/2024 10:30AM'
      },
      {
        status: 'Quoted',
        timestamp: '25/12/2024 10:45AM'
      }
    ],
    collaborators: [],
    documents: []
  },
  {
    no: 11,
    desc: 'PLACARD, TYRE PRESSURE',
    referenceNo: '04',
    rfqNo: 'PA/RO2/M50/200125/EMAIL',
    pno: '511.20.09.122',
    aes: 'E',
    quantity: 2,
    status: 'Quoted',
    date: '24/12/2024 3:20PM',
    timestamp: new Date('2024-12-24T15:20:00').getTime(),
    lastEditedBy: {
      name: 'Maria Rodriguez',
      initials: 'MR',
      timestamp: '24/12/2024 3:20PM'
    },
    statusTimeline: [
      {
        status: 'Created',
        timestamp: '24/12/2024 3:20PM'
      },
      {
        status: 'Quoted',
        timestamp: '24/12/2024 3:40PM'
      },
      {
        status: 'Quoted',
        timestamp: '26/12/2024 9:30AM'
      },
      {
        status: 'Quoted',
        timestamp: '30/12/2024 4:15PM'
      }
    ],
    collaborators: [],
    documents: []
  },
  {
    no: 13,
    desc: 'CIRCLIP, WAVE, ST, 29.1*2.5',
    referenceNo: '04',
    rfqNo: 'PA/RO2/M50/200125/EMAIL',
    pno: '9406100418',
    aes: 'E',
    quantity: 1,
    status: 'Quoted',
    date: '23/12/2024 11:45AM',
    timestamp: new Date('2024-12-23T11:45:00').getTime(),
    lastEditedBy: {
      name: 'Kevin Chen',
      initials: 'KC',
      timestamp: '23/12/2024 11:45AM'
    },
    statusTimeline: [
      {
        status: 'Created',
        timestamp: '23/12/2024 11:45AM'
      },
      {
        status: 'Quoted',
        timestamp: '23/12/2024 12:00PM'
      },
      {
        status: 'Quoted',
        timestamp: '24/12/2024 2:30PM'
      }
    ],
    collaborators: [],
    documents: []
  },
  {
    no: 14,
    desc: 'INDICATOR, CAUTION',
    referenceNo: '04',
    rfqNo: 'RFQM50-08012025-0013-RO1',
    pno: '9733219201',
    aes: 'E',
    quantity: 1,
    status: 'Quoted',
    date: '18/12/2024 4:15PM',
    timestamp: new Date('2024-12-18T16:15:00').getTime(),
    lastEditedBy: {
      name: 'Rachel Kim',
      initials: 'RK',
      timestamp: '18/12/2024 4:15PM'
    },
    statusTimeline: [
      {
        status: 'Created',
        timestamp: '18/12/2024 4:15PM'
      },
      {
        status: 'Quoted',
        timestamp: '18/12/2024 4:30PM'
      }
    ],
    collaborators: [],
    documents: []
  }
]

